description,title,short_description,image
Плоттеры/Brother,Режущий плоттер Brother DesignNCut DC100,Brother,https://avatars.mds.yandex.net/get-mpic/1865652/img_id9052080089339673832.jpeg/orig
Кухонные весы,Цифровые бытовые весы RUN RABBIT RR-2 (максимальная нагрузка 180 кг),,https://avatars.mds.yandex.net/get-mpic/1644362/img_id667181966382407681.jpeg/orig
Кухонные весы/Gemlux,Кухонные весы Gemlux GL-KS10 серебристый/черный,Gemlux,https://avatars.mds.yandex.net/get-mpic/1362400/img_id3622241165848276307.jpeg/orig
Аксессуары для кофемашин и кофеварок/Jura,Средство Jura Для декальцинации 9 шт.,Jura,https://avatars.mds.yandex.net/get-mpic/1860966/img_id3876422484224404409.jpeg/orig
Очистители и увлажнители воздуха/Boneco,"Мойка воздуха Boneco W1355A, белый",Boneco,https://avatars.mds.yandex.net/get-mpic/96484/img_id2373769742006226432/orig
Удлинители и сетевые фильтры,"Бытовой удлинитель HomeLine 3гн б/з без выкл. ПВС2х0,75 6А1,3кВт 1,5м серый",,https://avatars.mds.yandex.net/get-mpic/1901070/img_id1494674081255201461.jpeg/orig
Карты флэш-памяти/Kingston,Карта памяти Kingston SDC4/8GBSP,Kingston,https://avatars.mds.yandex.net/get-mpic/1111879/img_id230149307476846638.jpeg/orig
Другие массажеры/BRADEX,Массажер BRADEX роликовый (KZ 0485) бежевый,BRADEX,https://avatars.mds.yandex.net/get-mpic/1808939/img_id8605258454150278315.jpeg/orig
Принтеры и МФУ/Xerox,Принтер Xerox Phaser 6020 белый,Xerox,https://avatars.mds.yandex.net/get-mpic/1620389/img_id8995393312811528538/orig
Удлинители и сетевые фильтры/ФОТОН,"Удлинитель сетевой ""ФОТОН"" 16-23Е, 2м, 3 розетки, 16А, с заземл.,Черный",ФОТОН,https://avatars.mds.yandex.net/get-mpic/1927699/img_id6808900702123427934.png/orig
Коврики для мыши/ORICO,Коврик ORICO MPA3025 черный/синий,ORICO,https://avatars.mds.yandex.net/get-mpic/1669769/img_id2761743058340940988.jpeg/orig
Картриджи для оргтехники/T2,Картридж T2 IC-H056,T2,https://avatars.mds.yandex.net/get-mpic/1926093/img_id4084863679182846602.jpeg/orig
Посудомоечные машины/Electrolux,Посудомоечная машина Electrolux ESF 2400 OH,Electrolux,https://avatars.mds.yandex.net/get-mpic/1726038/img_id7451055232364663526/orig
Аэрогрили/CENTEK,Аэрогриль CENTEK CT-1456 белый,CENTEK,https://avatars.mds.yandex.net/get-mpic/200316/img_id504037576495764273.png/orig
"Кабели, разъемы, переходники/Apple",Кабель Apple USB Type-C - Lightning (MKQ42ZM/A) 2 м белый,Apple,https://avatars.mds.yandex.net/get-mpic/1382936/img_id8879875950062107174.jpeg/orig
USB-концентраторы/Defender,"USB-концентратор Defender Quadro Infix (83504), разъемов: 4, черный",Defender,https://avatars.mds.yandex.net/get-mpic/1111879/img_id1758870900611518421.jpeg/orig
Картриджи и сменные элементы для бытовых водоочистителей/Аквафор,"Аквафор В520-12 Модуль сменный, 1 шт.",Аквафор,https://avatars.mds.yandex.net/get-mpic/1859063/img_id5891053180562976918.jpeg/orig
Кофеварки и кофемашины/Polaris,Кофеварка рожковая Polaris PCM 1532E champagne,Polaris,https://avatars.mds.yandex.net/get-mpic/906397/img_id1373259130618168582.jpeg/orig
Фильтры и умягчители для воды/Prio Новая вода,Фильтр под мойкой Prio Новая вода Start Osmos OU380 пятиступенчатый,Prio Новая вода,https://avatars.mds.yandex.net/get-mpic/175985/img_id5345245047392036603.jpeg/orig
"Кабели, разъемы, переходники/Baseus",Кабель Baseus Portable USB - USB Type-C (CATMBJ) 0.23 м золотистый/черный,Baseus,https://avatars.mds.yandex.net/get-mpic/1522540/img_id3175858248026348009.jpeg/orig
Холодильники/Liebherr,Холодильник Liebherr CU 4015,Liebherr,https://avatars.mds.yandex.net/get-mpic/199079/img_id2984228902795772305/orig
Напольные весы/AKAI,Весы AKAI SB-1354V,AKAI,https://avatars.mds.yandex.net/get-mpic/1642819/img_id7093308595631689977/orig
Флешки USB/SanDisk,Флешка SanDisk Extreme Go USB 3.1 64GB черный,SanDisk,https://avatars.mds.yandex.net/get-mpic/1362400/img_id1005443382622009259.jpeg/orig
Офисная бумага и пленка/Bursten,Бумага A6 50 шт. Bursten HDR 150 г/м2 белый,Bursten,https://avatars.mds.yandex.net/get-mpic/1884605/img_id7172113139583727975.jpeg/orig
Пылесосы/Samsung,Пылесос Samsung SC4520 blue,Samsung,https://avatars.mds.yandex.net/get-mpic/1364191/img_id1915864705475807320.jpeg/orig
Очистители и увлажнители воздуха/Winia,"Мойка воздуха Winia AWX-70, белый/фиолетовый",Winia,https://avatars.mds.yandex.net/get-mpic/1808939/img_id7760639575870937591/orig
Грили и шашлычницы/VIGOR,Гриль VIGOR HX-7110 серый/черный,VIGOR,https://avatars.mds.yandex.net/get-mpic/1620389/img_id1001791905776912232.jpeg/orig
Блендеры/Braun,"Погружной блендер Braun MQ 775 Patisserie, черный/серебристый",Braun,https://avatars.mds.yandex.net/get-mpic/1669769/img_id1654677027308981605.jpeg/orig
Микроволновые печи/Candy,Микроволновая печь Candy CMXW 20 DS,Candy,https://avatars.mds.yandex.net/get-mpic/195452/img_id6563280414471681220/orig
Фены и фен-щётки/BRAYER,Фен BRAYER BR3000 черный,BRAYER,https://avatars.mds.yandex.net/get-mpic/1767083/img_id6413530499450364657.jpeg/orig
Принтеры и МФУ/HP,МФУ HP LaserJet Pro MFP M428fdw белый,HP,https://avatars.mds.yandex.net/get-mpic/1859063/img_id1012835327268078236.png/orig
"Кабели, разъемы, переходники/Romoss",Кабель Romoss 2в1 Lightning+MicroUSB CB20A плетеный золотой,Romoss,https://avatars.mds.yandex.net/get-mpic/1884605/img_id4844613813945670183.jpeg/orig
Чехлы для планшетов/Gosso,"Чехол Gosso 184075 для Apple iPad (2017/2018) 9.7"" прозрачный",Gosso,https://avatars.mds.yandex.net/get-mpic/1750207/img_id661790357296343899.jpeg/orig
"Щипцы, плойки и выпрямители/Riff",Щипцы Riff 1123/1 черный,Riff,https://avatars.mds.yandex.net/get-mpic/1605421/img_id4182736030830924878.jpeg/orig
Пылесосы/Thomas,Пылесос Thomas INOX 1520 Plus серебристый/черный,Thomas,https://avatars.mds.yandex.net/get-mpic/175985/img_id5152580792394114065/orig
Источники бесперебойного питания/Powerman,Интерактивный ИБП Powerman Back Pro Plus 600,Powerman,https://avatars.mds.yandex.net/get-mpic/195452/img_id3715249214758070921/orig
Маршрутизаторы и коммутаторы/TP-LINK,Коммутатор TP-LINK TL-SF1008D,TP-LINK,https://avatars.mds.yandex.net/get-mpic/200316/img_id9128443530261268102/orig
Картриджи для оргтехники/T2,Картридж T2 TC-H313,T2,https://avatars.mds.yandex.net/get-mpic/331398/img_id4304846681235946143.jpeg/orig
Компьютерная акустика/Oklick,Компьютерная акустика Oklick OK-115 черный,Oklick,https://avatars.mds.yandex.net/get-mpic/1538707/img_id5346665346234446715/orig
Очистители и увлажнители воздуха/Timberk,"Увлажнитель воздуха Timberk THU UL 15M, голубой/белый",Timberk,https://avatars.mds.yandex.net/get-mpic/1361544/img_id115347633552126326.jpeg/orig
Чехлы для планшетов/IT Baggage,"Чехол IT Baggage ITHWT215 для Huawei Media Pad T2 Pro 10"" черный",IT Baggage,https://avatars.mds.yandex.net/get-mpic/1081556/img_id3766642038158508914.jpeg/orig
"Кабели, разъемы, переходники",Кабель Crown USB - USB Type-C CMCU-3022C white,,https://avatars.mds.yandex.net/get-mpic/1669769/img_id3663453501548832950.jpeg/orig
Картриджи для оргтехники/T2,Картридж T2 IC-H130,T2,https://avatars.mds.yandex.net/get-mpic/195452/img_id1079950175424892888/orig
Встраиваемые духовые шкафы/Hansa,Электрический духовой шкаф Hansa BOEI64190055,Hansa,https://avatars.mds.yandex.net/get-mpic/1525999/img_id1176688582793486947.jpeg/orig
Холодильники/Snaige,Холодильник Snaige RF36SM-S1JJ21,Snaige,https://avatars.mds.yandex.net/get-mpic/1360806/img_id5702826912137034576.jpeg/orig
Ирригаторы/CS Medica,"Ирригатор CS Medica AquaPulsar OS1, белый/голубой",CS Medica,https://avatars.mds.yandex.net/get-mpic/96484/img_id6902918306639952180/orig
Холодильники/Liebherr,Холодильник Liebherr CN 4015,Liebherr,https://avatars.mds.yandex.net/get-mpic/195452/img_id427415761920721499/orig
Сумки и рюкзаки для ноутбуков,"Защитный чехол для MacBook Pro 13"" (2008-2012) iBest CMPro13",,https://avatars.mds.yandex.net/get-mpic/1855911/img_id7852703308439030148.jpeg/orig
Утюги/VITEK,Утюг VITEK VT-1201 (2010) коричневый/белый,VITEK,https://avatars.mds.yandex.net/get-mpic/199079/img_id6626267703866837970/orig
Приборы для ухода за лицом/FOREO,FOREO Смарт-маска для лица UFO (Fuchsia),FOREO,https://avatars.mds.yandex.net/get-mpic/1539743/img_id8615622369671593258.png/orig
Проекционные экраны/cactus,Рулонный матовый белый экран cactus Triscreen CS-PST-180x180,cactus,https://avatars.mds.yandex.net/get-mpic/1336510/img_id6036533073990373027.jpeg/orig
Кухонные весы/Polaris,Кухонные весы Polaris PKS 0323DL белый,Polaris,https://avatars.mds.yandex.net/get-mpic/96484/img_id9039542955259099483/orig
Картриджи и сменные элементы для бытовых водоочистителей/Аквафор,"Аквафор К3-КН-К7 Комплект модулей для Кристалл Умягчающий, 3 шт.",Аквафор,https://avatars.mds.yandex.net/get-mpic/1525215/img_id1146828593591311879.jpeg/orig
Фильтры и умягчители для воды/Аквафор,Фильтр кувшин Аквафор Прованс 4.2 л белый,Аквафор,https://avatars.mds.yandex.net/get-mpic/2008488/img_id2334967559877546111.jpeg/orig
Защитные пленки и стекла для планшетов,Защитное стекло Mocolo для iPad 2/3/4,,https://avatars.mds.yandex.net/get-mpic/1866085/img_id4928165937286374185.jpeg/orig
Принтеры и МФУ/HP,МФУ HP Color LaserJet Pro MFP M281fdn белый,HP,https://avatars.mds.yandex.net/get-mpic/397397/img_id1861753226003168.jpeg/orig
Защитные пленки и стекла для планшетов/LuxCase,"Защитное стекло LuxCase для Huawei MediaPad M5 10"" прозрачный",LuxCase,https://avatars.mds.yandex.net/get-mpic/1603927/img_id1149492462565706961.jpeg/orig
Компьютерные гарнитуры/Tt eSPORTS by Thermaltake,Компьютерная гарнитура Tt eSPORTS by Thermaltake Shock Pro RGB черный,Tt eSPORTS by Thermaltake,https://avatars.mds.yandex.net/get-mpic/397397/img_id4834238928529474312.jpeg/orig
Аксессуары для кофемашин и кофеварок/Filtero,Одноразовые фильтры для капельной кофеварки Filtero Premium Размер 4 40 шт.,Filtero,https://avatars.mds.yandex.net/get-mpic/1568604/img_id4690585721781572778.jpeg/orig
Клавиатуры/Logitech G,Клавиатура Logitech G G910 Orion Spectrum USB,Logitech G,https://avatars.mds.yandex.net/get-mpic/372220/img_id7400066040168559806.jpeg/orig
Кухонные вытяжки/MAUNFELD,Каминная вытяжка MAUNFELD EMMY 60 черный,MAUNFELD,https://avatars.mds.yandex.net/get-mpic/1888674/img_id6589015271148785061.jpeg/orig
"Кабели, разъемы, переходники/Baseus",Кабель Baseus Yaven USB - Lightning (CALUN-02) 1 м черный,Baseus,https://avatars.mds.yandex.net/get-mpic/1571888/img_id7447365247165379764.jpeg/orig
Фильтры и умягчители для воды/Ecotronic,Фильтр диспенсер настольный Ecotronic C6-1FE Silver,Ecotronic,https://avatars.mds.yandex.net/get-mpic/175985/img_id3079255283141123858/orig
Мыши/Canyon,Мышь Canyon CNE-CMSW1G Grey USB,Canyon,https://avatars.mds.yandex.net/get-mpic/1923922/img_id4312135625816187618/orig
Мониторы/Samsung,Монитор Samsung C27F390FHI черный,Samsung,https://avatars.mds.yandex.net/get-mpic/195452/img_id6371881203942818822/orig
Планшеты/Apple,Планшет Apple iPad mini 4 128Gb Wi-Fi + Cellular space grey,Apple,https://avatars.mds.yandex.net/get-mpic/1361544/img_id4747029820420296449.jpeg/orig
Планшеты/Apple,Планшет Apple iPad Air (2019) 256Gb Wi-Fi silver,Apple,https://avatars.mds.yandex.net/get-mpic/1808939/img_id7031835803119952902.jpeg/orig
Тостеры/Sakura,"Тостер Sakura SA-7608R, красный",Sakura,https://avatars.mds.yandex.net/get-mpic/466729/img_id2148237190975900574.jpeg/orig
Удлинители и сетевые фильтры/Power Cube,"Сетевой фильтр Power Cube Ф30 черный, 30 м",Power Cube,https://avatars.mds.yandex.net/get-mpic/1220464/img_id5269744684357149230.jpeg/orig
Фены и фен-щётки/BaByliss,Фен-щетка BaByliss AS510E black,BaByliss,https://avatars.mds.yandex.net/get-mpic/1862933/img_id3771405887626727883.jpeg/orig
Картриджи для оргтехники/Sakura,Картридж Sakura FX10,Sakura,https://avatars.mds.yandex.net/get-mpic/1101307/img_id4428472736129619918.png/orig
Другие массажеры/Релаксы,Массажер Релаксы Тапочки 41 размер красный,Релаксы,https://avatars.mds.yandex.net/get-mpic/1767151/img_id3017779452109841538.jpeg/orig
Другая техника для кухни/ONKRON,Тарелка для СВЧ ONKRON ER270,ONKRON,https://avatars.mds.yandex.net/get-mpic/1865543/img_id674543846907920441.jpeg/orig
Аксессуары для кофемашин и кофеварок/Oasiswj,Диспенсер для капсул Oasiswj YZ1313C серебристый,Oasiswj,https://avatars.mds.yandex.net/get-mpic/2008488/img_id452185937989939950.jpeg/orig
Электробритвы мужские/Микма,Электробритва Микма 211,Микма,https://avatars.mds.yandex.net/get-mpic/1642819/img_id4322432184024550542/orig
Картриджи для оргтехники/SuperFine,Картридж SuperFine SF-CF363X,SuperFine,https://avatars.mds.yandex.net/get-mpic/1862933/img_id2195399511684544930.jpeg/orig
Парогенераторы/RUNZEL,Парогенератор RUNZEL FOR-900 Utmarkt серебристый/черный/серый,RUNZEL,https://avatars.mds.yandex.net/get-mpic/931379/img_id4986381797502337114.jpeg/orig
Флешки USB/Transcend,Флешка Transcend JetFlash 790 32Gb белый/синий,Transcend,https://avatars.mds.yandex.net/get-mpic/1060343/img_id6577905755682172514.jpeg/orig
Посудомоечные машины/Electrolux,Посудомоечная машина Electrolux ESF 9422 LOW,Electrolux,https://avatars.mds.yandex.net/get-mpic/200316/img_id307444154233832808.png/orig
Ноутбуки/Acer,"Ноутбук Acer Predator Helios 300 (PH317-53-73TE) (Intel Core i7 9750H 2600 MHz/17.3""/1920x1080/16GB/1000GB SSD/DVD нет/NVIDIA GeForce GTX 1660 Ti/Wi-Fi/Bluetooth/Linux) PH317-53-73TE, NH.Q5PER.01B черный",Acer,https://avatars.mds.yandex.net/get-mpic/1545401/img_id6929011830938045484.png/orig
Водонагреватели/Electrolux,Накопительный электрический водонагреватель Electrolux EWH 80 Quantum Pro,Electrolux,https://avatars.mds.yandex.net/get-mpic/1244413/img_id7617303758031047345.png/orig
Модули управления для климатического оборудования/Huayu,Пульт ДУ Huayu K-6100 для кондиционера белый,Huayu,https://avatars.mds.yandex.net/get-mpic/1417902/img_id245999400037506546.jpeg/orig
Кофеварки и кофемашины/Kitfort,Кофеварка рожковая Kitfort KT-702 черный,Kitfort,https://avatars.mds.yandex.net/get-mpic/397397/img_id9026428900479628868/orig
Картриджи для оргтехники/MAK,Картридж MAK CE255A,MAK,https://avatars.mds.yandex.net/get-mpic/1349652/img_id3072446869075611387.jpeg/orig
"Кабели, разъемы, переходники/Adam Elements",Кабель Adam Elements PeAk II 20B (USB - Apple Lightning) 0.2 м серый,Adam Elements,https://avatars.mds.yandex.net/get-mpic/1363071/img_id1849753335678890388.jpeg/orig
Машинки для стрижки волос и триммеры/Scarlett,Триммер Scarlett SC-TR310M51 черный/оранжевый,Scarlett,https://avatars.mds.yandex.net/get-mpic/1928572/img_id6969886912872941449.jpeg/orig
Кухонные вытяжки/HOMS,Настенная вытяжка HOMSair SATURN 50 БЕЛЫЙ,HOMS,https://avatars.mds.yandex.net/get-mpic/1705137/img_id5296494790496595644.jpeg/orig
"Кабели, разъемы, переходники/WIIIX",Кабель WIIIX USB - microUSB (CB850-UMU-Z-10) 1 м черный,WIIIX,https://avatars.mds.yandex.net/get-mpic/1538707/img_id8841219101927168736.jpeg/orig
Блендеры/REDMOND,"Погружной блендер REDMOND RHB-2944, белый",REDMOND,https://avatars.mds.yandex.net/get-mpic/364668/img_id8840733975508719900.jpeg/orig
Мыши/CROWN MICRO,Мышь CROWN MICRO CMM- 935 W Black USB,CROWN MICRO,https://avatars.mds.yandex.net/get-mpic/1554397/img_id2272591718197241612.jpeg/orig
Кухонные плиты/Hansa,Газовая плита Hansa FCGW51001,Hansa,https://avatars.mds.yandex.net/get-mpic/1767083/img_id9020686279050702768/orig
Холодильники/Liebherr,Холодильник Liebherr TX 1021,Liebherr,https://avatars.mds.yandex.net/get-mpic/1045304/img_id4393797121137971914.jpeg/orig
Картриджи для оргтехники/Sakura,Картридж Sakura SAML1710D3,Sakura,https://avatars.mds.yandex.net/get-mpic/1865271/img_id1056077461115160940.jpeg/orig
Мультиварки/Polaris,Мультиварка Polaris PMC 0517AD/G графит,Polaris,https://avatars.mds.yandex.net/get-mpic/1382936/img_id8980106751712605171.jpeg/orig
Чехлы для планшетов/G-Case,Чехол G-Case Slim Premium для Samsung Galaxy Tab A 8.0 SM-T355 коричневый,G-Case,https://avatars.mds.yandex.net/get-mpic/1567763/img_id2787757163475304875.jpeg/orig
Морозильники/Liebherr,Морозильник Liebherr G 1223,Liebherr,https://avatars.mds.yandex.net/get-mpic/1657306/img_id2903825953535218447/orig
Стиральные машины/Candy,Стиральная машина Candy GVF4 137TWHB32,Candy,https://avatars.mds.yandex.net/get-mpic/1365202/img_id6840576283974160247.jpeg/orig
Вибромассажеры/Beurer,Вибромассажер ручной Beurer CM 100 Cellulite releaZer белый,Beurer,https://avatars.mds.yandex.net/get-mpic/1901070/img_id4785392596716478001.jpeg/orig
Графические планшеты/WACOM,Графический планшет WACOM One Small (CTL-472-N) черный/красный,WACOM,https://avatars.mds.yandex.net/get-mpic/1361544/img_id6458659265573775095.jpeg/orig
Сетевое оборудование Wi-Fi и Bluetooth/ASUS,Bluetooth адаптер ASUS USB-BT400,ASUS,https://avatars.mds.yandex.net/get-mpic/96484/img_id6415993732310840138/orig
